{
  "document_type": "invoice",
  "invoice_number": "КР-042/26",
  "invoice_date": "2026-09-18",
  "supplier": {
    "name": "ИП Карпова Марина Олеговна",
    "tax_id": "590312345678"
  },
  "buyer": {
    "name": "АО Северная Геология",
    "tax_id": "5407123456"
  },
  "currency": "USD",
  "subtotal": 4056.5,
  "vat_amount": 811.3,
  "total_amount": 4867.8,
  "line_items": [
    {
      "description": "Приемник спутниковой навигации GeoTrack",
      "quantity": 2.0,
      "unit": "шт.",
      "unit_price": 1480.0,
      "line_total": 2960.0
    },
    {
      "description": "Антенна усиленная GNSS",
      "quantity": 4.0,
      "unit": "шт.",
      "unit_price": 165.0,
      "line_total": 660.0
    },
    {
      "description": "Лицензия GeoField для полевых работ",
      "quantity": 6.0,
      "unit": "мес.",
      "unit_price": 95.0,
      "line_total": 570.0
    },
    {
      "description": "Экспресс-доставка до терминала",
      "quantity": 1.0,
      "unit": "усл.",
      "unit_price": 80.0,
      "line_total": 80.0
    },
    {
      "description": "Скидка постоянному заказчику 5 процентов",
      "quantity": 1.0,
      "unit": "усл.",
      "unit_price": -213.5,
      "line_total": -213.5
    }
  ]
}
