{
  "document_type": "invoice",
  "invoice_number": "БП-047/26",
  "invoice_date": "2026-10-14",
  "supplier": {
    "name": "АО Балтийский Прибор",
    "tax_id": "7805123458"
  },
  "buyer": {
    "name": "ООО Арктик Лаб",
    "tax_id": "2909123456"
  },
  "currency": "USD",
  "subtotal": 4244.0,
  "vat_amount": 848.8,
  "total_amount": 5092.8,
  "line_items": [
    {
      "description": "Модуль измерительный AX-4",
      "quantity": 8.0,
      "unit": "шт.",
      "unit_price": 412.5,
      "line_total": 3300.0
    },
    {
      "description": "Калибровка модуля",
      "quantity": 8.0,
      "unit": "шт.",
      "unit_price": 47.0,
      "line_total": 376.0
    },
    {
      "description": "Комплект кабелей",
      "quantity": 4.0,
      "unit": "комплект",
      "unit_price": 86.75,
      "line_total": 347.0
    },
    {
      "description": "Защитный кейс",
      "quantity": 2.0,
      "unit": "шт.",
      "unit_price": 129.0,
      "line_total": 258.0
    },
    {
      "description": "Экспресс-доставка",
      "quantity": 1.0,
      "unit": "услуга",
      "unit_price": 140.0,
      "line_total": 140.0
    },
    {
      "description": "Скидка по договору",
      "quantity": 1.0,
      "unit": "услуга",
      "unit_price": -177.0,
      "line_total": -177.0
    }
  ]
}
