{
  "document_type": "invoice",
  "invoice_number": "ГС-045/26",
  "invoice_date": "2026-10-01",
  "supplier": {
    "name": "ООО Городские Сети",
    "tax_id": "6672123457"
  },
  "buyer": {
    "name": "ИП Белова Алина Сергеевна",
    "tax_id": "667301234567"
  },
  "currency": "RUB",
  "subtotal": 183840.0,
  "vat_amount": 36768.0,
  "total_amount": 220608.0,
  "line_items": [
    {
      "description": "Точка доступа Wi-Fi 6",
      "quantity": 5.0,
      "unit": "шт.",
      "unit_price": 12700.0,
      "line_total": 63500.0
    },
    {
      "description": "Коммутатор PoE на 24 порта",
      "quantity": 2.0,
      "unit": "шт.",
      "unit_price": 28900.0,
      "line_total": 57800.0
    },
    {
      "description": "Оптический модуль SFP",
      "quantity": 6.0,
      "unit": "шт.",
      "unit_price": 5400.0,
      "line_total": 32400.0
    },
    {
      "description": "Патч-корд оптический",
      "quantity": 20.0,
      "unit": "шт.",
      "unit_price": 380.0,
      "line_total": 7600.0
    },
    {
      "description": "Монтаж сетевого оборудования",
      "quantity": 1.0,
      "unit": "услуга",
      "unit_price": 18600.0,
      "line_total": 18600.0
    },
    {
      "description": "Монтаж и маркировка портов",
      "quantity": 1.0,
      "unit": "услуга",
      "unit_price": 9200.0,
      "line_total": 9200.0
    },
    {
      "description": "Доставка до офиса покупателя",
      "quantity": 1.0,
      "unit": "услуга",
      "unit_price": 2400.0,
      "line_total": 2400.0
    },
    {
      "description": "Скидка за объем заказа 4 процента",
      "quantity": 1.0,
      "unit": "услуга",
      "unit_price": -7660.0,
      "line_total": -7660.0
    }
  ]
}
