{
  "document_type": "invoice",
  "invoice_number": "ПРЕД-025/2026",
  "invoice_date": "2026-09-19",
  "supplier": {
    "name": "АО Сибирские Серверы",
    "tax_id": "5408123467"
  },
  "buyer": {
    "name": "ООО Уральская Логистика",
    "tax_id": "6670456790"
  },
  "currency": "RUB",
  "subtotal": 243000.0,
  "vat_amount": 48600.0,
  "total_amount": 291600.0,
  "line_items": [
    {
      "description": "Аванс 50 процентов за поставку серверного шкафа",
      "quantity": 1.0,
      "unit": "шт.",
      "unit_price": 95000.0,
      "line_total": 95000.0
    },
    {
      "description": "Аванс 50 процентов за комплект ИБП для серверной",
      "quantity": 1.0,
      "unit": "комплект",
      "unit_price": 78000.0,
      "line_total": 78000.0
    },
    {
      "description": "Аванс 50 процентов за монтаж шкафа и ИБП",
      "quantity": 1.0,
      "unit": "услуга",
      "unit_price": 42500.0,
      "line_total": 42500.0
    },
    {
      "description": "Аванс 50 процентов за пусконаладочные работы",
      "quantity": 1.0,
      "unit": "этап",
      "unit_price": 27500.0,
      "line_total": 27500.0
    }
  ]
}
