{
  "document_type": "invoice",
  "invoice_number": "СФ 023-26",
  "invoice_date": "2026-09-17",
  "supplier": {
    "name": "АО ТехноФильтр",
    "tax_id": "5408123456"
  },
  "buyer": {
    "name": "АО Региональная Поликлиника",
    "tax_id": "5406123456"
  },
  "currency": "RUB",
  "subtotal": 191800.0,
  "vat_amount": 19180.0,
  "total_amount": 210980.0,
  "line_items": [
    {
      "description": "Комплект фильтров для вентиляционной установки",
      "quantity": 8.0,
      "unit": "комплект",
      "unit_price": 14750.0,
      "line_total": 118000.0
    },
    {
      "description": "Технический осмотр вентиляционного оборудования",
      "quantity": 3.0,
      "unit": "установка",
      "unit_price": 9200.0,
      "line_total": 27600.0
    },
    {
      "description": "Замена фильтрующих кассет на объектах",
      "quantity": 8.0,
      "unit": "кассета",
      "unit_price": 2100.0,
      "line_total": 16800.0
    },
    {
      "description": "Аварийный выезд инженера в течение рабочего дня",
      "quantity": 1.0,
      "unit": "выезд",
      "unit_price": 18500.0,
      "line_total": 18500.0
    },
    {
      "description": "Экспресс-доставка запасных частей",
      "quantity": 1.0,
      "unit": "доставка",
      "unit_price": 7400.0,
      "line_total": 7400.0
    },
    {
      "description": "Утилизация использованных фильтров с оформлением акта",
      "quantity": 1.0,
      "unit": "партия",
      "unit_price": 3500.0,
      "line_total": 3500.0
    }
  ]
}
