{
  "document_type": "invoice",
  "invoice_number": "СФ-29/09",
  "invoice_date": "2026-09-23",
  "supplier": {
    "name": "АО МеталлФорм Урал",
    "tax_id": "6674123456"
  },
  "buyer": {
    "name": "АО Инженерные Решения",
    "tax_id": "7704123456"
  },
  "currency": "RUB",
  "subtotal": 347980.0,
  "vat_amount": 69596.0,
  "total_amount": 417576.0,
  "line_items": [
    {
      "description": "Лист стальной оцинкованный толщиной 0,8 мм",
      "quantity": 1250.0,
      "unit": "кг",
      "unit_price": 178.0,
      "line_total": 222500.0
    },
    {
      "description": "Раскрой листа по карте заказчика",
      "quantity": 14.0,
      "unit": "лист",
      "unit_price": 2950.0,
      "line_total": 41300.0
    },
    {
      "description": "Гибка деталей на прессе с контролем угла",
      "quantity": 96.0,
      "unit": "шт.",
      "unit_price": 680.0,
      "line_total": 65280.0
    },
    {
      "description": "Контроль геометрии и упаковка партии",
      "quantity": 1.0,
      "unit": "партия",
      "unit_price": 18900.0,
      "line_total": 18900.0
    }
  ]
}
