{
  "document_type": "invoice",
  "invoice_number": "АЭ-104",
  "invoice_date": "2026-09-11",
  "supplier": {
    "name": "ООО Северный Контур",
    "tax_id": "6671456789"
  },
  "buyer": {
    "name": "ООО Точная Система",
    "tax_id": "7705123456"
  },
  "currency": "RUB",
  "subtotal": 100000.0,
  "vat_amount": 20000.0,
  "total_amount": 120000.0,
  "line_items": [
    {
      "description": "Доступ к аналитической системе",
      "quantity": 2.0,
      "unit": "месяц",
      "unit_price": 50000.0,
      "line_total": 100000.0
    }
  ]
}
