{
  "document_type": "invoice",
  "invoice_number": "05-06/25",
  "invoice_date": "2025-06-05",
  "supplier": {
    "name": "ООО Канцелярский Дом",
    "tax_id": "1650999009"
  },
  "buyer": {
    "name": "ООО Полярный Офис",
    "tax_id": "7801001010"
  },
  "currency": "RUB",
  "subtotal": 35502,
  "vat_amount": 7100.4,
  "total_amount": 42602.4,
  "line_items": [
    {
      "description": "Бумага офисная А4, плотность 80 г/м², 500 листов",
      "quantity": 25,
      "unit": "пач.",
      "unit_price": 365,
      "line_total": 9125
    },
    {
      "description": "Картридж лазерный универсальный, ресурс 2 000 страниц",
      "quantity": 3,
      "unit": "шт.",
      "unit_price": 4890,
      "line_total": 14670
    },
    {
      "description": "Папка-регистратор с арочным механизмом",
      "quantity": 12,
      "unit": "шт.",
      "unit_price": 418.75,
      "line_total": 5025
    },
    {
      "description": "Маркер текстовый, набор 4 цвета",
      "quantity": 8,
      "unit": "наб.",
      "unit_price": 276.5,
      "line_total": 2212
    },
    {
      "description": "Этикетки самоклеящиеся для маркировки коробов",
      "quantity": 6,
      "unit": "рул.",
      "unit_price": 745,
      "line_total": 4470
    }
  ]
}
