{
  "document_type": "invoice",
  "invoice_number": "МК-902",
  "invoice_date": "2025-09-02",
  "supplier": {
    "name": "ООО Молочная Коллекция",
    "tax_id": "6161017006"
  },
  "buyer": {
    "name": "ООО Береговая Столовая",
    "tax_id": "2309018007"
  },
  "currency": "RUB",
  "subtotal": 75502,
  "vat_amount": 7550.2,
  "total_amount": 83052.2,
  "line_items": [
    {
      "description": "Молоко ультрапастеризованное 3,2 процента",
      "quantity": 240,
      "unit": "л",
      "unit_price": 78.4,
      "line_total": 18816
    },
    {
      "description": "Масло сливочное 82,5 процента",
      "quantity": 36.5,
      "unit": "кг",
      "unit_price": 690,
      "line_total": 25185
    },
    {
      "description": "Сыр полутвердый фасованный",
      "quantity": 22,
      "unit": "кг",
      "unit_price": 845.5,
      "line_total": 18601
    },
    {
      "description": "Творог 5 процентов",
      "quantity": 48,
      "unit": "кг",
      "unit_price": 268.75,
      "line_total": 12900
    }
  ]
}

