{
  "document_type": "invoice",
  "invoice_number": "45-УПД",
  "invoice_date": "2025-03-03",
  "supplier": {
    "name": "АО Маяк Инжиниринг",
    "tax_id": "7708993003"
  },
  "buyer": {
    "name": "ООО ТехноРитм",
    "tax_id": "6671994004"
  },
  "currency": "RUB",
  "subtotal": 74000,
  "vat_amount": 14800,
  "total_amount": 88800,
  "line_items": [
    {
      "description": "Обследование сетевого оборудования и составление технического отчета",
      "quantity": 1,
      "unit": "усл.",
      "unit_price": 48500,
      "line_total": 48500
    },
    {
      "description": "Настройка резервного копирования серверов",
      "quantity": 2,
      "unit": "усл.",
      "unit_price": 12750,
      "line_total": 25500
    }
  ]
}

