{
  "document_type": "invoice",
  "invoice_number": "ЛИЦ-902/26",
  "invoice_date": "2026-03-11",
  "supplier": {
    "name": "ООО Платформа Тихий офис",
    "tax_id": "7811123456"
  },
  "buyer": {
    "name": "ООО Архитектурное бюро Новая перспектива",
    "tax_id": "7806123456"
  },
  "currency": "RUB",
  "subtotal": 167400.00,
  "vat_amount": 33480.00,
  "total_amount": 200880.00,
  "line_items": [
    {
      "description": "Годовая лицензия на программный комплекс для управления проектами, пакет на 25 пользователей",
      "quantity": 1.00,
      "unit": "лицензия",
      "unit_price": 186000.00,
      "line_total": 186000.00
    },
    {
      "description": "Скидка при оплате до 20.03.2026, 10 процентов",
      "quantity": 1.00,
      "unit": "услуга",
      "unit_price": -18600.00,
      "line_total": -18600.00
    }
  ]
}
