{
  "document_type": "invoice",
  "invoice_number": "МБ-020",
  "invoice_date": "2026-06-02",
  "supplier": {
    "name": "ООО Новая Форма",
    "tax_id": "1650473892"
  },
  "buyer": {
    "name": "ООО Сеть Ранних Стартов",
    "tax_id": "6671214083"
  },
  "currency": "RUB",
  "subtotal": 217350.0,
  "vat_amount": 43470.0,
  "total_amount": 260820.0,
  "line_items": [
    {
      "description": "Кресло офисное Орбита",
      "quantity": 7.0,
      "unit": "шт.",
      "unit_price": 28900.0,
      "line_total": 202300.0
    },
    {
      "description": "Сборка офисного кресла",
      "quantity": 7.0,
      "unit": "услуга",
      "unit_price": 1250.0,
      "line_total": 8750.0
    },
    {
      "description": "Доставка до адреса покупателя",
      "quantity": 1.0,
      "unit": "рейс",
      "unit_price": 6300.0,
      "line_total": 6300.0
    }
  ]
}
