{
  "document_type": "invoice",
  "invoice_number": "СЗ-204",
  "invoice_date": "2026-02-27",
  "supplier": {
    "name": "ИП Фёдоров Марат Тимурович",
    "tax_id": "667812345679"
  },
  "buyer": {
    "name": "АНО Центр городской среды Новая линия",
    "tax_id": "6670123456"
  },
  "currency": "RUB",
  "subtotal": 24900.00,
  "vat_amount": 0.00,
  "total_amount": 24900.00,
  "line_items": [
    {
      "description": "Диагностика блока управления вентиляцией",
      "quantity": 1.00,
      "unit": "усл.",
      "unit_price": 7800.00,
      "line_total": 7800.00
    },
    {
      "description": "Замена и настройка блока питания контроллера",
      "quantity": 1.00,
      "unit": "комплект",
      "unit_price": 12400.00,
      "line_total": 12400.00
    },
    {
      "description": "Выезд инженера на объект и итоговые замеры",
      "quantity": 2.00,
      "unit": "выезд",
      "unit_price": 2350.00,
      "line_total": 4700.00
    }
  ]
}
